[
  {
    "name": "Aluminum",
    "color": [0.916, 0.923, 0.924],
    "metalness": 1,
    "specularColor": [0.989, 0.989, 0.972],
    "roughness": 0,
    "ior": 1.5,
    "complexIor": [0.728978, 6.45971, 0.588215, 5.19646, 0.78354, 4.37746],
    "density": 2700,
    "category": ["Metal"],
    "description": "",
    "sources": [
      "https://refractiveindex.info/?shelf=main&book=Al&page=Cheng",
      "https://arxiv.org/pdf/2512.23696#appendix.D",
      "https://en.wikipedia.org/wiki/Aluminium",
      "https://en.wikipedia.org/wiki/Density",
      "https://en.wikipedia.org/wiki/Mirror"
    ],
    "tags": ["aluminium", "mirror"],
    "reference": [
      "https://raw.githubusercontent.com/AntonPalmqvist/physically-based-api/main/images/renders/cycles/600/aluminum.jpeg"
    ]
  },
  {
    "name": "Banana",
    "color": [0.634, 0.532, 0.111],
    "metalness": 0,
    "roughness": 0.5,
    "ior": 1.5,
    "density": 0,
    "category": ["Organic"],
    "description": "",
    "sources": ["https://spectraldb.com/measurements/00379/"],
    "tags": [""],
    "reference": [
      "https://raw.githubusercontent.com/AntonPalmqvist/physically-based-api/main/images/renders/cycles/600/banana.jpeg"
    ]
  },
  {
    "name": "Beryllium",
    "color": [0.539, 0.533, 0.534],
    "metalness": 1,
    "specularColor": [0.549, 0.503, 0.364],
    "roughness": 0,
    "ior": 1.5,
    "complexIor": [3.21038, 3.29815, 3.32907, 3.11669, 3.77105, 2.66995],
    "density": 1850,
    "category": ["Metal"],
    "description": "",
    "sources": [
      "https://refractiveindex.info/?shelf=main&book=Be&page=Rakic-BB",
      "https://arxiv.org/pdf/2512.23696#appendix.D",
      "https://en.wikipedia.org/w/index.php?title=Beryllium&oldid=1295895956",
      "https://en.wikipedia.org/wiki/Density"
    ],
    "tags": [""],
    "reference": [
      "https://raw.githubusercontent.com/AntonPalmqvist/physically-based-api/main/images/renders/cycles/600/beryllium.jpeg"
    ]
  },
  {
    "name": "Blackboard",
    "color": [0.039, 0.039, 0.039],
    "metalness": 0,
    "roughness": 0.9,
    "ior": 1.5,
    "density": 0,
    "category": ["Manmade"],
    "description": "",
    "sources": [
      "https://spectraldb.com/measurements/00079/",
      "https://github.com/AntonPalmqvist/physically-based-api/tree/main/data/materials/blackboard/"
    ],
    "tags": [""],
    "reference": [
      "https://raw.githubusercontent.com/AntonPalmqvist/physically-based-api/main/images/renders/cycles/600/blackboard.jpeg"
    ]
  },
  {
    "name": "Blood",
    "color": [0.64448, 0.003, 0.005],
    "metalness": 0,
    "roughness": 0,
    "ior": 1.35,
    "transmission": 1,
    "transmissionDepth": 0.08,
    "transmissionDispersion": 54,
    "density": 1060,
    "viscosity": 2.8,
    "surfaceTension": 56,
    "category": ["Human"],
    "description": "The color of blood depends on its oxygen level. When there is plenty of oxygen, the color is a brighter red. The reason is because of a protein called hemoglobin, which carries the oxygen in your blood. When hemoglobin has a full oxygen load, it has a bright red color, and when it's deoxygenated it's a darker red. For example, arterial and capillary blood is bright, and venous blood is dark.",
    "sources": [
      "https://en.wikipedia.org/wiki/Blood",
      "https://en.wikipedia.org/wiki/Blood_red",
      "https://refractiveindex.info/?shelf=other&book=blood&page=Liu",
      "https://hypertextbook.com/facts/2004/MichaelShmukler.shtml",
      "https://www.researchgate.net/figure/Color-chart-for-the-measurement-of-methemoglobin-The-color-chart-was-prepared-according_fig2_26884296",
      "https://www.engineeringtoolbox.com/absolute-viscosity-liquids-d_1259.html",
      "https://en.wikipedia.org/wiki/Hemorheology",
      "https://www.frontiersin.org/articles/10.3389/fphys.2019.01329/full",
      "https://nextlimitsupport.atlassian.net/wiki/spaces/rf2016docs/pages/5497120/Hybrido+Viscosity+Table",
      "https://wiki.anton-paar.com/en/whole-blood/",
      "https://en.wikipedia.org/w/index.php?title=Surface_tension&oldid=1304099149#Values"
    ],
    "tags": ["liquid"],
    "reference": [
      "https://raw.githubusercontent.com/AntonPalmqvist/physically-based-api/main/images/renders/cycles/600/blood.jpeg"
    ]
  },
  {
    "name": "Bone",
    "color": [0.793, 0.793, 0.664],
    "metalness": 0,
    "roughness": 0.9,
    "ior": 1.5,
    "density": 1900,
    "densityRange": [1000, 2000],
    "category": ["Organic"],
    "description": "",
    "sources": [
      "https://hypertextbook.com/facts/2002/AnnaYarusskaya.shtml",
      "https://www.tandfonline.com/doi/pdf/10.3109/02841867809127938",
      "https://en.wikipedia.org/wiki/Bone"
    ],
    "tags": ["skeleton"],
    "reference": [
      "https://raw.githubusercontent.com/AntonPalmqvist/physically-based-api/main/images/renders/cycles/600/bone.jpeg"
    ]
  },
  {
    "name": "Brass",
    "color": [0.91, 0.778, 0.423],
    "metalness": 1,
    "specularColor": [0.995, 0.974, 0.747],
    "roughness": 0,
    "ior": 1.5,
    "complexIor": [0.341048, 4.14088, 0.53349, 2.67993, 1.42749, 1.87543],
    "density": 8600,
    "category": ["Metal"],
    "description": "Brass is an alloy of copper and zinc, with a bright and gold-like appearance. It is similar to bronze, another alloy containing copper that uses tin instead of zinc. Historically, the distinction between the two alloys has been less consistent and clear, and modern practice in museums and archaeology increasingly avoids both terms for historical objects in favor of the more general \"copper alloy\".",
    "sources": [
      "https://refractiveindex.info/?shelf=3d&book=metals&page=brass",
      "https://arxiv.org/pdf/2512.23696#appendix.D",
      "https://en.wikipedia.org/wiki/Brass",
      "https://en.wikipedia.org/wiki/Density"
    ],
    "tags": [""],
    "reference": [
      "https://raw.githubusercontent.com/AntonPalmqvist/physically-based-api/main/images/renders/cycles/600/brass.jpeg"
    ]
  },
  {
    "name": "Brick",
    "color": [0.262, 0.095, 0.061],
    "metalness": 0,
    "roughness": 0.9,
    "ior": 1.5,
    "density": 2000,
    "densityRange": [500, 2400],
    "acousticAbsorption": [0.03, 0.03, 0.03, 0.04, 0.05, 0.07],
    "category": ["Manmade"],
    "description": "",
    "sources": [
      "https://github.com/AntonPalmqvist/physically-based-api/tree/main/data/materials/brick/",
      "https://en.wikipedia.org/wiki/Brick",
      "https://www.acoustic-supplies.com/absorption-coefficient-chart/",
      "https://en.wikipedia.org/wiki/Absorption_(acoustics)",
      "https://www.acoustic.ua/st/web_absorption_data_eng.pdf"
    ],
    "tags": [""],
    "reference": [
      "https://raw.githubusercontent.com/AntonPalmqvist/physically-based-api/main/images/renders/cycles/600/brick.jpeg"
    ]
  },
  {
    "name": "Car Paint",
    "color": [0.1, 0.1, 0.1],
    "metalness": 0,
    "roughness": 0,
    "ior": 1.5,
    "density": 0,
    "category": ["Manmade"],
    "description": "Modern car paints are nearly always an acrylic polyurethane \"enamel\" with a pigmented basecoat and a clear topcoat. It may be described as \"acrylic\", \"acrylic enamel\", \"urethane\", etc. and the clearcoat in particular may be described as a lacquer. The size of the metal flakes in metallic paints is typically between 100 to 400 microns in diameter. Modern automobile paint is applied in several layers, with a total thickness of around 100 μm (0.1mm).",
    "sources": [
      "https://en.wikipedia.org/wiki/Automotive_paint",
      "https://en.wikipedia.org/wiki/Lacquer#Acrylic_lacquers",
      "https://hal.science/hal-04030017/document",
      "https://patentscope.wipo.int/search/en/detail.jsf?docId=WO2011163461",
      "https://thecandeshop.com/metal-flake-for-cars/",
      "https://www.theultimatefinish.co.uk/car-care-blog/featured/paintwork/"
    ],
    "tags": ["acrylic", "coat", "car paint", "lacquer"],
    "reference": [
      "https://raw.githubusercontent.com/AntonPalmqvist/physically-based-api/main/images/renders/cycles/600/car-paint.jpeg"
    ]
  },
  {
    "name": "Carrot",
    "color": [0.713, 0.17, 0.026],
    "metalness": 0,
    "roughness": 0.5,
    "ior": 1.5,
    "density": 0,
    "category": ["Organic"],
    "description": "",
    "sources": ["https://spectraldb.com/measurements/00456/"],
    "tags": [""],
    "reference": [
      "https://raw.githubusercontent.com/AntonPalmqvist/physically-based-api/main/images/renders/cycles/600/carrot.jpeg"
    ]
  },
  {
    "name": "Cesium",
    "color": [0.718, 0.554, 0.237],
    "metalness": 1,
    "specularColor": [0.997, 1.002, 1.073],
    "roughness": 0,
    "ior": 1.5,
    "complexIor": [0.204334, 1.19256, 0.272018, 0.906033, 0.449252, 0.517209],
    "density": 1886,
    "category": ["Metal"],
    "description": "",
    "sources": [
      "https://refractiveindex.info/?shelf=main&book=Cs&page=Monin",
      "https://arxiv.org/pdf/2512.23696#appendix.D",
      "https://en.wikipedia.org/w/index.php?title=Caesium&oldid=1297091310"
    ],
    "tags": ["caesium"],
    "reference": [
      "https://raw.githubusercontent.com/AntonPalmqvist/physically-based-api/main/images/renders/cycles/600/cesium.jpeg"
    ]
  },
  {
    "name": "Charcoal",
    "color": [0.02, 0.02, 0.02],
    "metalness": 0,
    "roughness": 0.9,
    "ior": 1.5,
    "density": 300,
    "densityRange": [200, 500],
    "category": ["Organic"],
    "description": "",
    "sources": [
      "https://chrisbrejon.com/articles/albedo-and-pointers-gamut/",
      "https://seblagarde.wordpress.com/2011/08/17/feeding-a-physical-based-lighting-mode/",
      "http://ukrfuel.com/news-physical-properties-of-charcoal-22.html",
      "https://en.wikipedia.org/wiki/Activated_carbon"
    ],
    "tags": [""],
    "reference": [
      "https://raw.githubusercontent.com/AntonPalmqvist/physically-based-api/main/images/renders/cycles/600/charcoal.jpeg"
    ]
  },
  {
    "name": "Chocolate",
    "color": [0.162, 0.091, 0.06],
    "metalness": 0,